{
  "title": "CLI ALIAS CONFIGURATION COMMAND",
  "description": "This command allows the operator to configure CLI alias commands for the system.\n\nAlias names may not match any of the reserved cli node keywords. Alias names \nmay not contain whitespace or chars '?' or '#'. Alias names may not match an \nexisting alias value.\n\nAlias values may not contain chars '?' or '#'. '\\n' or '\\r' are disallowed \nunless they are used within literal string parameters. An alias value may not \nmatch an existing alias name.\n\nCli command parameters entered as part of the alias value will not be validated \nuntil the alias is executed.\n\nThe order of the displayed alias commands when executing the 'info configure \nalias' command does not persist after an NT switchover or reset.",
  "user_level": "The command can be accessed by operators with equipment privileges, and \nexecuted by operators with equipment privileges.",
  "syntax": "> configure alias (name) (value)",
  "resource_parameters": [
    {
      "name": "(name)",
      "description": "alias name"
    }
  ],
  "command_parameters": [],
  "raw": "help configure alias\r\nCLI ALIAS CONFIGURATION COMMAND\r\n===============================\r\n\r\nCommand Description\r\n-------------------\r\n\r\nThis command allows the operator to configure CLI alias commands for the system.\r\n\r\nAlias names may not match any of the reserved cli node keywords. Alias names \r\nmay not contain whitespace or chars '?' or '#'. Alias names may not match an \r\nexisting alias value.\r\n\r\nAlias values may not contain chars '?' or '#'. '\\n' or '\\r' are disallowed \r\nunless they are used within literal string parameters. An alias value may not \r\nmatch an existing alias name.\r\n\r\nCli command parameters entered as part of the alias value will not be validated \r\nuntil the alias is executed.\r\n\r\nThe order of the displayed alias commands when executing the 'info configure \r\nalias' command does not persist after an NT switchover or reset.\r\n\r\n\r\nUser Level\r\n----------\r\n\r\nThe command can be accessed by operators with equipment privileges, and \r\nexecuted by operators with equipment privileges.\r\n\r\nCommand Syntax\r\n--------------\r\n\r\nThe command has the following syntax:\r\n> configure alias (name) (value)\r\n\r\nCommand Parameters\r\n------------------\r\n\r\nTable \"CLI Alias Configuration Command\" Resource Parameters\r\n\r\nResource Identifier        Description\r\n\r\n(name)                     alias name\r\n\r\nTable \"CLI Alias Configuration Command\" Command Parameters\r\n\r\nParameter                  Description\r\n\r\n(value)                    command string for alias\r\n                           mandatory parameter\r\n\r\n                           Parameter type: <CLI::AliasValue>\r\n                           Format:\r\n                           - command string for alias\r\n                           - length: 2<=x<=128 \r\n\r\n\r\nDS-LIN-TEST-01:automationuser>#"
}