{
  "title": "QOS SINGLE DOT1P MARKER CONFIGURATION COMMAND",
  "description": "This command allows the operator to configure a marker for singleDot1P.",
  "user_level": "The command can be accessed by operators with qos privileges, and executed by \noperators with qos privileges.",
  "syntax": "> configure qos profiles marker ( no d1p (name) ) | ( d1p (name) default-dot1p <Qos::ExtVlanSysPrio> )",
  "resource_parameters": [
    {
      "name": "(name)",
      "description": "A unique profile name"
    }
  ],
  "command_parameters": [
    {
      "name": "default-dot1p",
      "description": "the default dot-1p bit value to be applied on all frames mandatory parameter - the dot-1p bit value - range: [0...7] DS-LIN-TEST-01:automationuser>#",
      "type": "<Qos::ExtVlanSysPrio>"
    }
  ],
  "raw": "help configure qos profiles marker d1p\r\nQOS SINGLE DOT1P MARKER CONFIGURATION COMMAND\r\n=============================================\r\n\r\nCommand Description\r\n-------------------\r\n\r\nThis command allows the operator to configure a marker for singleDot1P.\r\n\r\n\r\nUser Level\r\n----------\r\n\r\nThe command can be accessed by operators with qos privileges, and executed by \r\noperators with qos privileges.\r\n\r\nCommand Syntax\r\n--------------\r\n\r\nThe command has the following syntax:\r\n> configure qos profiles marker ( no d1p (name) ) | ( d1p (name) default-dot1p \r\n<Qos::ExtVlanSysPrio> )\r\n\r\nCommand Parameters\r\n------------------\r\n\r\nTable \"QoS Single Dot1P Marker Configuration Command\" Resource Parameters\r\n\r\nResource Identifier        Description\r\n\r\n(name)                     A unique profile name\r\n\r\nTable \"QoS Single Dot1P Marker Configuration Command\" Command Parameters\r\n\r\nParameter                  Description\r\n\r\ndefault-dot1p              the default dot-1p bit value to be applied on all \r\nframes\r\n                           mandatory parameter\r\n\r\n                           Parameter type: <Qos::ExtVlanSysPrio>\r\n                           Format:\r\n                           - the dot-1p bit value\r\n                           - range: [0...7]\r\n\r\n\r\nDS-LIN-TEST-01:automationuser># \r\n\r\n25/10/25 19:37:30 major alarm occurred for ip-addr 192.168.222.11  : Successful Management login, 8 , Username : automationuser , Type : CLI\r\n\r\nDS-LIN-TEST-01:automationuser>#"
}