{
  "title": "ATM PVC CONFIGURATION COMMAND",
  "description": "This command allows the operator to configure an ATM PVC.\n\nThe admin status allows or disallows traffic on the PVC.\n\nThe encapsulation type configures the way higher-layer traffic is encapsulated \nin the AAL5 container.\n\nThe LLC Encapsulation method allows the multiplexing of multiple protocols over \na single ATM VC. The protocol type of each PDU is identified by a prefixed IEEE \n802.2 LLC header.\n\n\n\nIn the VC Multiplexing method, each ATM VC carries PDUs of exactly one protocol \ntype. When multiple protocols must be transported, there is a separate VC for \neach protocol type.\n\nUse of the encapsulations:\n  - llc-snap and vc-mux-bridged-8023 can be used for cross-connects, ibridge, \nPPPoE, and IPoE\n  - llc-snap-routed and vc-mux-routed can be used for IPoA\n  - llc-nlpid and vc-mux-pppoa can be used for PPPoA\n  - none can be used for ATM pseudowire\n\nIt is also possible to automatically detect the used encapsulation type on the \nlink.\n  - automatic:ip is used for auto-detection between llc-snap, \nvc-mux-bridged-8023, llc-snap-routed, and vc-mux-routed; ipoe and ipoa \ndataframes are accepted;\n  - automatic:ppp is used for auto-detection between llc-snap, \nvc-mux-bridged-8023, llc-nlpid, and vc-mux-pppoa; pppoa and pppoe dataframes \nare accepted;\n  - automatic:pppoa is used for auto-detection between llc-nlpid and \nvc-mux-pppoa, only pppoa dataframes are accepted;\n  - automatic:ipoe-ppp is used for auto-detection between llc-snap, \nvc-mux-bridged-8023, llc-nlpid and vc-mux-pppoa; ipoe, pppoa and pppoe \ndataframes are accepted;\n\nThe only encapsulation type supported on L2 LTs is llc-snap.",
  "user_level": "The command can be accessed by operators with atm privileges, and executed by \noperators with atm privileges.",
  "syntax": "> configure atm ( no pvc (port-index) ) | ( pvc (port-index) [ [ no ] admin-down ] [ no aal5-encap-type | aal5-encap-type <Atm::VccEncapType> ] )",
  "resource_parameters": [
    {
      "name": "(port-index)",
      "description": "the atm static Interface with vpi and vci"
    }
  ],
  "command_parameters": [
    {
      "name": "[no] admin-down",
      "description": "disable traffic flow optional parameter",
      "type": "boolean"
    },
    {
      "name": "[no] aal5-encap-type",
      "description": "encapsulation method for traffic in an AAL5 container optional parameter with default value: \"llc-snap\"",
      "type": "<Atm::VccEncapType>",
      "format": "( llc-snap                            | llc-snap-routed                            | llc-nlpid                            | vc-mux-bridged-8023                            | vc-mux-routed                            | vc-mux-pppoa                            | none                            | automatic : ip                            | automatic : ppp                            | automatic : pppoa                            | automatic : ipoe-ppp )",
      "values": [
        "llc-snap              : logical link control encapsulation bridged protocol",
        "llc-snap-routed       : logical link control encapsulation routed protocol",
        "llc-nlpid             : logical link control encapsulation pppoa protocol",
        "vc-mux-bridged-8023   : virtual channel multiplex bridged protocol",
        "vc-mux-routed         : virtual channel multiplex routed protocol",
        "vc-mux-pppoa          : virtual channel multiplex pppoa protocol",
        "automatic             : automatic detection of encapsulation type",
        "none                  : no encapsulation type Possible values:",
        "ip                    : autodetection of the used ip encapsulation",
        "ppp                   : autodetection of the used ppp encapsulation",
        "pppoa                 : autodetection of the used pppoa encapsulation",
        "ipoe-ppp              : autodetection of the used ip or ppp encapsulation"
      ],
      "default": "llc-snap"
    }
  ],
  "raw": "help configure atm pvc\r\nATM PVC CONFIGURATION COMMAND\r\n=============================\r\n\r\nCommand Description\r\n-------------------\r\n\r\nThis command allows the operator to configure an ATM PVC.\r\n\r\nThe admin status allows or disallows traffic on the PVC.\r\n\r\nThe encapsulation type configures the way higher-layer traffic is encapsulated \r\nin the AAL5 container.\r\n\r\nThe LLC Encapsulation method allows the multiplexing of multiple protocols over \r\na single ATM VC. The protocol type of each PDU is identified by a prefixed IEEE \r\n802.2 LLC header.\r\r\n\r\n\r\nIn the VC Multiplexing method, each ATM VC carries PDUs of exactly one protocol \r\ntype. When multiple protocols must be transported, there is a separate VC for \r\neach protocol type.\r\n\r\nUse of the encapsulations:\r\n  - llc-snap and vc-mux-bridged-8023 can be used for cross-connects, ibridge, \r\nPPPoE, and IPoE\r\n  - llc-snap-routed and vc-mux-routed can be used for IPoA\r\n  - llc-nlpid and vc-mux-pppoa can be used for PPPoA\r\n  - none can be used for ATM pseudowire\r\n\r\nIt is also possible to automatically detect the used encapsulation type on the \r\nlink.\r\n  - automatic:ip is used for auto-detection between llc-snap, \r\nvc-mux-bridged-8023, llc-snap-routed, and vc-mux-routed; ipoe and ipoa \r\ndataframes are accepted;\r\n  - automatic:ppp is used for auto-detection between llc-snap, \r\nvc-mux-bridged-8023, llc-nlpid, and vc-mux-pppoa; pppoa and pppoe dataframes \r\nare accepted;\r\n  - automatic:pppoa is used for auto-detection between llc-nlpid and \r\nvc-mux-pppoa, only pppoa dataframes are accepted;\r\n  - automatic:ipoe-ppp is used for auto-detection between llc-snap, \r\nvc-mux-bridged-8023, llc-nlpid and vc-mux-pppoa; ipoe, pppoa and pppoe \r\ndataframes are accepted;\r\n\r\nThe only encapsulation type supported on L2 LTs is llc-snap.\r\n\r\n\r\nUser Level\r\n----------\r\n\r\nThe command can be accessed by operators with atm privileges, and executed by \r\noperators with atm privileges.\r\n\r\nCommand Syntax\r\n--------------\r\n\r\nThe command has the following syntax:\r\n> configure atm ( no pvc (port-index) ) | ( pvc (port-index) [ [ no ] \r\nadmin-down ] [ no aal5-encap-type | aal5-encap-type <Atm::VccEncapType> ] )\r\n\r\nCommand Parameters\r\n------------------\r\n\r\nTable \"ATM PVC Configuration Command\" Resource Parameters\r\n\r\nResource Identifier        Description\r\n\r\n(port-index)               the atm static Interface with vpi and vci\r\n\r\nTable \"ATM PVC Configuration Command\" Command Parameters\r\n\r\nParameter                  Description\r\n\r\n[no] admin-down            disable traffic flow\r\n                           optional parameter\r\n\r\n                           Parameter type: boolean\r\n                           \r\n\r\n[no] aal5-encap-type       encapsulation method for traffic in an AAL5 container\r\n                           optional parameter with default value: \"llc-snap\"\r\n\r\n                           Parameter type: <Atm::VccEncapType>\r\n                           Format:\r\n                           ( llc-snap\r\n                           | llc-snap-routed\r\n                           | llc-nlpid\r\n                           | vc-mux-bridged-8023\r\n                           | vc-mux-routed\r\n                           | vc-mux-pppoa\r\n                           | none\r\n                           | automatic : ip\r\n                           | automatic : ppp\r\n                           | automatic : pppoa\r\n                           | automatic : ipoe-ppp )\r\n                           Possible values:\r\n                           - llc-snap              : logical link control \r\nencapsulation bridged protocol\r\n                           - llc-snap-routed       : logical link control \r\nencapsulation routed protocol\r\n                           - llc-nlpid             : logical link control \r\nencapsulation pppoa protocol\r\n                           - vc-mux-bridged-8023   : virtual channel multiplex \r\nbridged protocol\r\n                           - vc-mux-routed         : virtual channel multiplex \r\nrouted protocol\r\n                           - vc-mux-pppoa          : virtual channel multiplex \r\npppoa protocol\r\n                           - automatic             : automatic detection of \r\nencapsulation type\r\n                           - none                  : no encapsulation type\r\n                           Possible values:\r\n                           - ip                    : autodetection of the used \r\nip encapsulation\r\n                           - ppp                   : autodetection of the used \r\nppp encapsulation\r\n                           - pppoa                 : autodetection of the used \r\npppoa encapsulation\r\n                           - ipoe-ppp              : autodetection of the used \r\nip or ppp encapsulation\r\n\r\n\r\nDS-LIN-TEST-01:automationuser>#"
}