{
  "title": "ANI ONT THERSHOLD CONFIGURATION COMMAND",
  "description": "This command edits provisioning data associated with an ONT ANI.",
  "user_level": "The command can be accessed by operators with equipment privileges, and \nexecuted by operators with equipment privileges.",
  "syntax": "> configure ani ont ( no tca-thresh (ont-idx) ) | ( tca-thresh (ont-idx) [ no lower-optical-th | lower-optical-th <Gpon::OpticalthreshLow> ] [ no upper-optical-th | upper-optical-th <Gpon::OpticalthreshHigh> ] [ no rssi-profile | rssi-profile <Gpon::RssiProfileId> ] )",
  "resource_parameters": [
    {
      "name": "(ont-idx)",
      "description": "ont index"
    }
  ],
  "command_parameters": [
    {
      "name": "[no] lower-optical-th",
      "description": "indicates the optical level the ONT uses to declare the Low received.Value 0.5 dBm means ONT internal choice which would be MIB default 1 optional parameter with default value: 0.5 - optical level ONT uses to declare the low recieved - unit: dBm - range: [-127...0.5]",
      "type": "<Gpon::OpticalthreshLow>",
      "default": "0.5"
    },
    {
      "name": "[no] upper-optical-th",
      "description": "indicates the optical level the ONT uses to declare the High received.Value 0.5 dBm means ONT internal choice which would be MIB default 1 optional parameter with default value: 0.5 - optical level ONT uses to declare the high recieved - unit: dBm - range: [-127...0.5]",
      "type": "<Gpon::OpticalthreshHigh>",
      "default": "0.5"
    },
    {
      "name": "[no] rssi-profile",
      "description": "an unique index of the rssi profile(0-200) optional parameter with default value: \"0\" - an unique index value for the rssi profile(0-200 configurable) - range: [0...200] DS-LIN-TEST-01:automationuser>#",
      "type": "<Gpon::RssiProfileId>",
      "default": "0"
    }
  ],
  "raw": "help configure ani ont tca-thresh\r\nANI ONT THERSHOLD CONFIGURATION COMMAND\r\n=======================================\r\n\r\nCommand Description\r\n-------------------\r\n\r\nThis command edits provisioning data associated with an ONT ANI.\r\n\r\n\r\nUser Level\r\n----------\r\n\r\nThe command can be accessed by operators with equipment privileges, and \r\nexecuted by operators with equipment privileges.\r\n\r\nCommand Syntax\r\n--------------\r\n\r\nThe command has the following syntax:\r\n> configure ani ont ( no tca-thresh (ont-idx) ) | ( tca-thresh (ont-idx) [ no \r\nlower-optical-th | lower-optical-th <Gpon::OpticalthreshLow> ] [ no \r\nupper-optical-th | upper-optical-th <Gpon::OpticalthreshHigh> ] [ no \r\nrssi-profile | rssi-profile <Gpon::RssiProfileId> ] )\r\n\r\nCommand Parameters\r\n------------------\r\n\r\nTable \"ANI ONT Thershold Configuration Command\" Resource Parameters\r\n\r\nResource Identifier        Description\r\n\r\n(ont-idx)                  ont index\r\n\r\nTable \"ANI ONT Thershold Configuration Command\" Command Parameters\r\n\r\nParameter                  Description\r\n\r\n[no] lower-optical-th      indicates the optical level the ONT uses to declare \r\nthe Low received.Value 0.5 dBm means ONT internal choice which would be MIB \r\ndefault 1\r\n                           optional parameter with default value: 0.5\r\n\r\n                           Parameter type: <Gpon::OpticalthreshLow>\r\n                           Format:\r\n                           - optical level ONT uses to declare the low recieved\r\n                           - unit: dBm\r\n                           - range: [-127...0.5]\r\n\r\n[no] upper-optical-th      indicates the optical level the ONT uses to declare \r\nthe High received.Value 0.5 dBm means ONT internal choice which would be MIB \r\ndefault 1\r\n                           optional parameter with default value: 0.5\r\n\r\n                           Parameter type: <Gpon::OpticalthreshHigh>\r\n                           Format:\r\n                           - optical level ONT uses to declare the high recieved\r\n                           - unit: dBm\r\n                           - range: [-127...0.5]\r\n\r\n[no] rssi-profile          an unique index of the rssi profile(0-200)\r\n                           optional parameter with default value: \"0\"\r\n\r\n                           Parameter type: <Gpon::RssiProfileId>\r\n                           Format:\r\n                           - an unique index value for the rssi profile(0-200 \r\nconfigurable)\r\n                           - range: [0...200]\r\n\r\n\r\nDS-LIN-TEST-01:automationuser># \r\n\r\n25/10/25 19:08:19 major alarm occurred for ip-addr 192.168.222.11  : Successful Management login, TimeStamp : 25/10/25 19:08:18 , Username : automationuser , Type : CLI\r\n\r\nDS-LIN-TEST-01:automationuser># \r\n\r\n25/10/25 19:08:19 major alarm cleared for ip-addr 192.168.222.11  : Successful Management login, TimeStamp : 25/10/25 19:08:04 , Username : automationuser , Type : CLI\r\n\r\nDS-LIN-TEST-01:automationuser>#"
}