{
  "title": "2XE1/DS1 CLOCK CONFIGURATION COMMAND",
  "description": "This command allows the operator to configure clock source on the 2xE1/DS1 sfp:",
  "user_level": "The command can be accessed by operators with equipment privileges, and \nexecuted by operators with equipment privileges.",
  "syntax": "> configure equipment sfpe1t1 ( no clock (position) ) | ( clock (position) [ no clocksource | clocksource <Eqpt::ClockSource> ] )",
  "resource_parameters": [
    {
      "name": "(position)",
      "description": "the physical sfp cage position"
    }
  ],
  "command_parameters": [
    {
      "name": "[no] clocksource",
      "description": "Clock source can be tributary1 or tributary2  or serdes optional parameter with default value: \"serdes\"",
      "type": "<Eqpt::ClockSource>",
      "format": "( tributary1                            | tributary2                            | serdes )",
      "values": [
        "tributary1            : clock source is from tributary 1",
        "tributary2            : clock source is from tributary 2",
        "serdes                : clock source is from serdes"
      ],
      "default": "serdes"
    }
  ],
  "raw": "help configure equipment sfpe1t1 clock\r\n2XE1/DS1 CLOCK CONFIGURATION COMMAND\r\n====================================\r\n\r\nCommand Description\r\n-------------------\r\n\r\nThis command allows the operator to configure clock source on the 2xE1/DS1 sfp:\r\n\r\n\r\nUser Level\r\n----------\r\n\r\nThe command can be accessed by operators with equipment privileges, and \r\nexecuted by operators with equipment privileges.\r\n\r\nCommand Syntax\r\n--------------\r\n\r\nThe command has the following syntax:\r\n> configure equipment sfpe1t1 ( no clock (position) ) | ( clock (position) [ no \r\nclocksource | clocksource <Eqpt::ClockSource> ] )\r\n\r\nCommand Parameters\r\n------------------\r\n\r\nTable \"2xE1/DS1 CLOCK configuration Command\" Resource Parameters\r\n\r\nResource Identifier        Description\r\n\r\n(position)                 the physical sfp cage position\r\n\r\nTable \"2xE1/DS1 CLOCK configuration Command\" Command Parameters\r\n\r\nParameter                  Description\r\n\r\n[no] clocksource           Clock source can be tributary1 or tributary2  or \r\nserdes \r\n                           optional parameter with default value: \"serdes\"\r\n\r\n                           Parameter type: <Eqpt::ClockSource>\r\n                           Format:\r\n                           ( tributary1\r\n                           | tributary2\r\n                           | serdes )\r\n                           Possible values:\r\n                           - tributary1            : clock source is from \r\ntributary 1\r\n                           - tributary2            : clock source is from \r\ntributary 2\r\n                           - serdes                : clock source is from serdes\r\n\r\n\r\nDS-LIN-TEST-01:automationuser>#"
}