{
  "title": "QOS CAC PROFILE CONFIGURATION COMMAND",
  "description": "This command allows the operator to configure a connection admission control \n(CAC) profile. CAC profiles are used primarily for multicast video admission \ncontrol. CAC profiles can be attached to subscriber interfaces. The scope of a \nCAC profile is a DSL link (and not a PVC), regardless of the number of PVCs on \na DSL link.\n\nThe system derives the line rate from the physical interfaces and calculates an \nestimate of the available Ethernet bandwidth using configurable overhead \nfactors. The line rate taken into account may be the guaranteed sync rate or \nthe actual line rate in case of DSL, based on a global configuration setting.\n\nFrom this bandwidth, a part can be reserved for voice and data applications and \nthe remaining part will be kept by the system as the available bandwidth for \nmulticast video. Only preconfigured multicast streams are considered for CAC. \nNote that unicast video (regardless of whether it is premium content or generic \nInternet streaming video) is ignored by the CAC function.\n\nThe maximum bandwidth that video will occupy can be further confined using the \nmaximum multicast bandwidth 'max-mcast-bandwidth' parameter.\n\nCAC profiles are applicable to line cards, but not to SHub/IHub interfaces.",
  "user_level": "The command can be accessed by operators with qos privileges, and executed by \noperators with qos privileges.",
  "syntax": "> configure qos profiles ( no cac (name) ) | ( cac (name) res-voice-bandwidth <Qos::BandWidthKBPS> max-mcast-bandwidth <Qos::BandWidthKBPS> res-data-bandwidth <Qos::BandWidthKBPS> [ no cac-type | cac-type <Qos::QosCacType> ] )",
  "resource_parameters": [
    {
      "name": "(name)",
      "description": "A unique profile name"
    }
  ],
  "command_parameters": [
    {
      "name": "res-voice-bandwidth",
      "description": "reserved bandwidth for the voice services mandatory parameter - interface bandwidth - unit: kbps - range: [0...2147483647]",
      "type": "<Qos::BandWidthKBPS>"
    },
    {
      "name": "max-mcast-bandwidth",
      "description": "maximum allowed bandwidth for multicast and unicast video service mandatory parameter - interface bandwidth - unit: kbps - range: [0...2147483647]",
      "type": "<Qos::BandWidthKBPS>"
    },
    {
      "name": "res-data-bandwidth",
      "description": "reserved bandwidth for all data services mandatory parameter - interface bandwidth - unit: kbps - range: [0...2147483647]",
      "type": "<Qos::BandWidthKBPS>"
    },
    {
      "name": "[no] cac-type",
      "description": "cac-profile type optional parameter with default value: \"dsl-cac\"",
      "type": "<Qos::QosCacType>",
      "format": "( dsl-cac                            | pon-cac                            | generic-pon-cac )",
      "values": [
        "dsl-cac               : cac profile for dsl links",
        "pon-cac               : cac profile for pon interfaces obsolete alternative replaced by generic-pon-cac",
        "generic-pon-cac       : cac profile for epon gpon and ngpon2 interfaces"
      ],
      "default": "dsl-cac"
    }
  ],
  "raw": "help configure qos profiles cac\r\nQOS CAC PROFILE CONFIGURATION COMMAND\r\n=====================================\r\n\r\nCommand Description\r\n-------------------\r\n\r\nThis command allows the operator to configure a connection admission control \r\n(CAC) profile. CAC profiles are used primarily for multicast video admission \r\ncontrol. CAC profiles can be attached to subscriber interfaces. The scope of a \r\nCAC profile is a DSL link (and not a PVC), regardless of the number of PVCs on \r\na DSL link.\r\n\r\nThe system derives the line rate from the physical interfaces and calculates an \r\nestimate of the available Ethernet bandwidth using configurable overhead \r\nfactors. The line rate taken into account may be the guaranteed sync rate or \r\nthe actual line rate in case of DSL, based on a global configuration setting.\r\n\r\nFrom this bandwidth, a part can be reserved for voice and data applications and \r\nthe remaining part will be kept by the system as the available bandwidth for \r\nmulticast video. Only preconfigured multicast streams are considered for CAC. \r\nNote that unicast video (regardless of whether it is premium content or generic \r\nInternet streaming video) is ignored by the CAC function.\r\n\r\nThe maximum bandwidth that video will occupy can be further confined using the \r\nmaximum multicast bandwidth 'max-mcast-bandwidth' parameter.\r\n\r\nCAC profiles are applicable to line cards, but not to SHub/IHub interfaces.\r\n\r\n\r\nUser Level\r\n----------\r\n\r\nThe command can be accessed by operators with qos privileges, and executed by \r\noperators with qos privileges.\r\n\r\nCommand Syntax\r\n--------------\r\n\r\nThe command has the following syntax:\r\n> configure qos profiles ( no cac (name) ) | ( cac (name) res-voice-bandwidth \r\n<Qos::BandWidthKBPS> max-mcast-bandwidth <Qos::BandWidthKBPS> \r\nres-data-bandwidth <Qos::BandWidthKBPS> [ no cac-type | cac-type \r\n<Qos::QosCacType> ] )\r\n\r\nCommand Parameters\r\n------------------\r\n\r\nTable \"QoS CAC Profile Configuration Command\" Resource Parameters\r\n\r\nResource Identifier        Description\r\n\r\n(name)                     A unique profile name\r\n\r\nTable \"QoS CAC Profile Configuration Command\" Command Parameters\r\n\r\nParameter                  Description\r\n\r\nres-voice-bandwidth        reserved bandwidth for the voice services\r\n                           mandatory parameter\r\n\r\n                           Parameter type: <Qos::BandWidthKBPS>\r\n                           Format:\r\n                           - interface bandwidth\r\n                           - unit: kbps\r\n                           - range: [0...2147483647]\r\n\r\nmax-mcast-bandwidth        maximum allowed bandwidth for multicast and unicast \r\nvideo service\r\n                           mandatory parameter\r\n\r\n                           Parameter type: <Qos::BandWidthKBPS>\r\n                           Format:\r\n                           - interface bandwidth\r\n                           - unit: kbps\r\n                           - range: [0...2147483647]\r\n\r\nres-data-bandwidth         reserved bandwidth for all data services\r\n                           mandatory parameter\r\n\r\n                           Parameter type: <Qos::BandWidthKBPS>\r\n                           Format:\r\n                           - interface bandwidth\r\n                           - unit: kbps\r\n                           - range: [0...2147483647]\r\n\r\n[no] cac-type              cac-profile type\r\n                           optional parameter with default value: \"dsl-cac\"\r\n\r\n                           Parameter type: <Qos::QosCacType>\r\n                           Format:\r\n                           ( dsl-cac\r\n                           | pon-cac\r\n                           | generic-pon-cac )\r\n                           Possible values:\r\n                           - dsl-cac               : cac profile for dsl links\r\n                           - pon-cac               : cac profile for pon \r\ninterfaces\r\n                                                     obsolete alternative \r\nreplaced by generic-pon-cac\r\n                           - generic-pon-cac       : cac profile for epon gpon \r\nand ngpon2 interfaces\r\n\r\n\r\nDS-LIN-TEST-01:automationuser>#"
}